{"blockers":["arm-02_sha256s_manifest","arm-03_sha256s_manifest","arm-04_sha256s_manifest","arm-05_sha256s_manifest","snowflake_remote_code_byte_hashes","qwen_measured_max_input_tokens","dense_adapter_parity","artifact_return_storage","live_quote_and_provider_instance","external_termination_and_ttl"],"canonical_bindings":{"budget_profile_sha256":"a333dd34da1b79682599b3411e1fdda0d7e7857e20e7d484d1e27887279d5485","envelope_sha256":"539855ce396fe7438d7ee870d43bd7f7c22be311424542bbcbd8bfd0ce70dcd5","inputs_sha256":"ed45bc579546ef7de0d297d5efc77b4d5fe1b5c68f0e52a2fa554482a75aaf86","lockset_sha256":"99add84f2da3989f679cce5d0eebdcbb284e1cda2d91d0116a8063bc495aeea7","shutdown_plan_sha256":"bc9dccb9f5dd2448cfe31ccefb322c86dd2774d8d048d54d5f84b03185b312f3"},"claim_boundary":"owner_local_metadata_preflight_only_no_measured_retrieval_authority","cpu_only":true,"credentials_accessed":false,"evidence_class":"engineering_preflight","execution_contract_adopted":false,"generated_at":"2026-08-05T22:20:24Z","gpu_reserved":false,"launch_ready":false,"measured_execution":false,"next_authorized_action":"Owner supplies sanitized manifests, live provider quote/identity, storage, parity, Qwen length, and termination receipt; rerun CPU preflight before contract adoption.","owner_input":{"adapter_parity":{"status":"pending_owner_input"},"manifests":{"ARM-02":{"file_count":0,"status":"pending_owner_input"},"ARM-03":{"file_count":0,"status":"pending_owner_input"},"ARM-04":{"file_count":0,"status":"pending_owner_input"},"ARM-05":{"file_count":0,"status":"pending_owner_input"}},"owner_root_supplied":false,"protected_root_accessed":false,"provider_preflight":{"credential_present":false,"status":"pending_owner_input"},"qwen_measured_max_length":{"status":"pending_owner_input"},"snowflake_remote_code":{"status":"pending_owner_input"},"storage":{"status":"pending_owner_input"},"termination_dry_run":{"credential_present":false,"status":"pending_owner_input"}},"phase_id":"A1_BASELINES_AND_MULTI_ARM_SCREENING","protected_data_accessed":false,"real_counters":{"candidate_count":0,"final_accesses":0,"measured_runs":0,"selection_accesses":0},"receipt_id":"a1.2-owner-local-preflight-20260805T222024Z","receipt_sha256":"9557aab753986f7d593d4f1f9916862204e54474d6b52fd1c3f5df096336a9d3","resource_counters":{"charged_usd":0,"gpu_reservations":0,"gpu_scientific_runs":0,"model_downloads":0,"paid_api_calls":0},"schema_version":"myis.armindex-a1.2-owner-local-preflight.v1","scientific_authority":false,"status":"blocked_owner_input","task_id":"A1.2"}
